"","KEYWORDS","TITLE","ABSTRACT","code","text","class"
"50","KeywordsEye movements Event detection Deep learning Fixation Saccade PSO ","gazenet: end-to-end eye-movement event detection with deep neural networks","Existing event detection algorithms for eye-movement data almost exclusively rely on thresholding one or more hand-crafted signal features, each computed from the stream of raw gaze data. Moreover, this thresholding is largely left for the end user. Here we present and develop gazeNet, a new framework for creating event detectors that do not require hand-crafted signal features or signal thresholding. It employs an end-to-end deep learning approach, which takes raw eye-tracking data as input and classifies it into fixations, saccades and post-saccadic oscillations. Our method thereby challenges an established tacit assumption that hand-crafted features are necessary in the design of event detection algorithms. The downside of the deep learning approach is that a large amount of training data is required. We therefore first develop a method to augment hand-coded data, so that we can strongly enlarge the data set used for training, minimizing the time spent on manual coding. Using this extended hand-coded data, we train a neural network that produces eye-movement event classification from raw eye-movement data without requiring any predefined feature extraction or post-processing steps. The resulting classification performance is at the level of expert human coders. Moreover, an evaluation of gazeNet on two other datasets showed that gazeNet generalized to data from different eye trackers and consistently outperformed several other event detection algorithms that we tested.","No","eye movement event detect deep learn fixat saccad pso gazenet endend eyemov event detect deep neural network exist event detect algorithm eyemov data exclus reli threshold handcraft signal featur comput stream raw gaze data threshold larg left end user present develop gazenet framework creat event detector requir handcraft signal featur signal threshold employ endend deep learn approach take raw eyetrack data input classifi fixat saccad postsaccad oscil method challeng establish tacit assumpt handcraft featur design event detect algorithm downsid deep learn approach larg amount train data requir develop method augment handcod data strong enlarg data set train minim time spent manual code extend handcod data train neural network produc eyemov event classif raw eyemov data requir predefin featur extract postprocess step result classif perform level expert human coder evalu gazenet dataset show gazenet general data eye tracker consist outperform event detect algorithm test",1
"51","PRIMARY care, HEALTH disparities, PUBLIC health, MEDICAL policy, POPULATION dynamics, Biology and life sciences, Canada, Earth sciences, Geographic areas, Geographic distribution, Geographical locations, Geography, Health care, Health care providers, Languages, Linguistic geography, Linguistics, Medical doctors, Medical personnel, Medicine and health sciences, North America, Ontario, People and places, Physicians, Population biology, Population dynamics, Population groupings, Primary care, Professions, Research Article, Social sciences, Urban areas","a geospatial approach to understanding inequalities in accessibility to primary care among vulnerable populations.","Many Canadians experience unequal access to primary care services, despite living in a country with a universal health care system. Health inequalities affect all Canadians but have a much stronger impact on the health of vulnerable populations. Health inequalities are preventable differences in the health status or distribution of health resources as experienced by vulnerable populations. A geospatial approach was applied to examine how closely the distribution of primary care providers (PCPs) in London, Ontario meet the needs of vulnerable populations, including people with low income status, seniors, lone parents, and linguistic minorities. Using enhanced two step floating catchment area (E2SFCA) method, an index of geographic access scores for all PCPs and PCPs speaking French, Arabic, and Spanish were separately developed at the dissemination area (DA) level. To analyze how PCPs are distributed, comparative analyses were performed in association with specific vulnerable groups. G)","No","primari care health dispar public health medic polici popul dynam biolog life scienc canada earth scienc geograph area geograph distribut geograph locat geographi health care health care provid languag linguist geographi linguist medic doctor medic personnel medicin health scienc north america ontario peopl place physician popul biolog popul dynam popul group primari care profess research articl social scienc urban area geospati approach understand inequ access primari care vulner popul canadian experi unequ access primari care servic live countri univers health care system health inequ affect canadian stronger impact health vulner popul health inequ prevent differ health status distribut health resourc experienc vulner popul geospati approach appli examin close distribut primari care provid pcps london ontario meet vulner popul includ peopl low incom status senior lone parent linguist minor enhanc step float catchment area esfca method index geograph access score pcps pcps speak french arab spanish separ develop dissemin area da level analyz pcps distribut compar analys perform associ specif vulner group",1
"52","LINGUISTIC change, LANGUAGE ability testing, DIGLOSSIA (Linguistics), SECOND language acquisition, LANGUAGES in contact, MOZAMBIQUE, Research Article","a model of contact-induced language change: testing the role of second language speakers in the evolution of mozambican portuguese.","Language change is accelerated by language contact, especially by contact that occurs when a group of speakers shifts from one language to another. This has commonly been explained by linguistic innovation occurring during second language acquisition. This hypothesis is based on historical reconstructions of instances of contact and has not been formally tested on empirical data. In this paper, we construct an agent-based model to formalize the hypothesis that second language speakers are responsible for accelerated language change during language shift. We compare model predictions to a unique combination of diachronic linguistic and demographic data from Maputu, Mozambique. The model correctly predicts an increased proportional use of the novel linguistic variants during the period we study. We find that a modified version of the model is a better fit to one of our two datasets and discuss plausible reasons for this. As a general conclusion concerning typological differences between)","No","linguist chang languag abil test diglossia linguist languag acquisit languag contact mozambiqu research articl model contactinduc languag chang test role languag speaker evolut mozambican portugues languag chang acceler languag contact contact occur group speaker shift languag common explain linguist innov occur languag acquisit hypothesi base histor reconstruct instanc contact formal test empir data paper construct agentbas model formal hypothesi languag speaker respons acceler languag chang languag shift compar model predict uniqu combin diachron linguist demograph data maputu mozambiqu model correct predict increas proport linguist variant period studi find modifi version model fit dataset discuss plausibl reason general conclus typolog differ",1
"53","AUTOMATIC speech recognition, MEMORY disorders, SPEECH processing systems, FEATURE selection, NEURODEGENERATION, COGNITIVE neuroscience, Acoustics, Alzheimer's disease, Bioacoustics, Biology and life sciences, Cognition, Cognitive impairment, Cognitive neurology, Cognitive neuroscience, Cognitive science, Dementia, Engineering and technology, Learning and memory, Linguistics, Medicine and health sciences, Memory, Mental health and psychiatry, Neurodegenerative diseases, Neurology, Neuroscience, Physical sciences, Physics, Research Article, Signal processing, Social sciences, Speech, Speech signal processing","a new diagnostic approach for the identification of patients with neurodegenerative cognitive complaints.","Neurodegenerative diseases causing dementia are known to affect a person‚Äôs speech and language. Part of the expert assessment in memory clinics therefore routinely focuses on detecting such features. The current outpatient procedures examining patients‚Äô verbal and interactional abilities mainly focus on verbal recall, word fluency, and comprehension. By capturing neurodegeneration-associated characteristics in a person‚Äôs voice, the incorporation of novel methods based on the automatic analysis of speech signals may give us more information about a person‚Äôs ability to interact which could contribute to the diagnostic process. In this proof-of-principle study, we demonstrate that purely acoustic features, extracted from recordings of patients‚Äô answers to a neurologist‚Äôs questions in a specialist memory clinic can support the initial distinction between patients presenting with cognitive concerns attributable to progressive neurodegenerative disorders (ND) or Functional Memory Disorder ()","No","automat speech recognit memori disord speech process system featur select neurodegener cognit neurosci acoust alzheim diseas bioacoust biolog life scienc cognit cognit impair cognit neurolog cognit neurosci cognit scienc dementia engin technolog learn memori linguist medicin health scienc memori mental health psychiatri neurodegen diseas neurolog neurosci physic scienc physic research articl signal process social scienc speech speech signal process diagnost approach identif patient neurodegen cognit complaint neurodegen diseas caus dementia affect person speech languag part expert assess memori clinic routin focus detect featur current outpati procedur examin patient verbal interact abil focus verbal recal word fluenci comprehens captur neurodegener characterist person voic incorpor method base automat analysi speech signal give inform person abil interact contribut diagnost process proofprincipl studi demonstr pure acoust featur extract record patient answer neurologist question specialist memori clinic support initi distinct patient present cognit concern attribut progress neurodegen disord function memori disord",1
"54","COCHLEAR implants, HEARING aids, HEARING disorders in children, SPEECH processing systems, POSTOPERATIVE period, Anatomy, Auditory cortex, Auditory system, Biology and life sciences, Brain, Central nervous system, Deafness, Hearing, Hearing disorders, Linguistics, Medicine and health sciences, Nervous system, Neuroscience, Otology, Otorhinolaryngology, Pediatric surgery, Pediatrics, Physiology, Psychology, Research Article, Sensory perception, Sensory physiology, Sensory systems, Social sciences, Speech, Surgical and invasive medical procedures","a preliminary study of auditory mismatch response on the day of cochlear implant activation in children with hearing aids prior implantation.","Objective:  The study aimed to explore the characteristics of auditory mismatch response (MMR) in hearing-impaired children on the day when the cochlear implant (CI) was started (power-up) and the speech processor was programmed, and to investigate the effects of wearing hearing aids (HAs) before cochlear implantation on the early stage of postoperative auditory cortex plasticity, providing some demonstrative data for the objective evaluation of postoperative early auditory ability in children who underwent cochlear implantation. Methods:  The participants were 34 children with profound sensorineural hearing loss, who underwent cochlear implantation. The classical passive Oddball paradigm was adopted, using a pair of vowels which only have different lexical tones. The standard stimulus was /a2/ and the devious stimulus was /a4/. Results:  1) On the day of CI activation, the auditory MMR has been elicited in 30 children; the MMR incidence was 88%. 2) We observed both positive and negat)","No","cochlear implant hear aid hear disord children speech process system postop period anatomi auditori cortex auditori system biolog life scienc brain central nervous system deaf hear hear disord linguist medicin health scienc nervous system neurosci otolog otorhinolaryngolog pediatr surgeri pediatr physiolog psycholog research articl sensori percept sensori physiolog sensori system social scienc speech surgic invas medic procedur preliminari studi auditori mismatch respons day cochlear implant activ children hear aid prior implant object studi aim explor characterist auditori mismatch respons mmr hearingimpair children day cochlear implant ci start power speech processor program investig effect wear hear aid cochlear implant earli stage postop auditori cortex plastic provid demonstr data object evalu postop earli auditori abil children underw cochlear implant method particip children profound sensorineur hear loss underw cochlear implant classic passiv oddbal paradigm adopt pair vowel lexic tone standard stimulus a devious stimulus a result day ci activ auditori mmr elicit children mmr incid observ posit negat",1
"55","VOCABULARY, LEXICAL access, DECISION making, FACE perception, STEREOTYPES, TASK performance, Anatomy, Biology and life sciences, Cognition, Cognitive neuroscience, Cognitive psychology, Cognitive science, Engineering and technology, Face, Face recognition, Grammar, Head, Learning and memory, Lexical decision tasks, Linguistics, Medicine and health sciences, Memory, Neurolinguistics, Neuroscience, Perception, Phonology, Psychology, Reaction time, Research Article, Semantics, Signal processing, Social sciences, Speech, Speech signal processing","abstract social categories facilitate access to socially skewed words.","Recent work has shown that listeners process words faster if said by a member of the group that typically uses the word. This paper further explores how the social distributions of words affect lexical access by exploring whether access is facilitated by invoking more abstract social categories. We conduct four experiments, all of which combine an Implicit Association Task with a Lexical Decision Task. Participants sorted real and nonsense words while at the same time sorting older and younger faces (exp. 1), male and female faces (exp. 2), stereotypically male and female objects (exp. 3), and framed and unframed objects, which were always stereotypically male or female (exp. 4). Across the experiments, lexical decision to socially skewed words is facilitated when the socially congruent category is sorted with the same hand. This suggests that the lexicon contains social detail from which individuals make social abstractions that can influence lexical access. [ABSTRACT FROM AUTHOR], C)","No","vocabulari lexic access decis make face percept stereotyp task perform anatomi biolog life scienc cognit cognit neurosci cognit psycholog cognit scienc engin technolog face face recognit grammar head learn memori lexic decis task linguist medicin health scienc memori neurolinguist neurosci percept phonolog psycholog reaction time research articl semant signal process social scienc speech speech signal process abstract social categori facilit access social skew word recent work shown listen process word faster member group typic word paper explor social distribut word affect lexic access explor access facilit invok abstract social categori conduct experi combin implicit associ task lexic decis task particip sort real nonsens word time sort older younger face exp male femal face exp stereotyp male femal object exp frame unfram object stereotyp male femal exp experi lexic decis social skew word facilit social congruent categori sort hand suggest lexicon social detail individu make social abstract influenc lexic access abstract author",1
"56","WORD frequency, DIFFUSION, TASKS, COGNITIVE neuroscience, REACTION time, ALPHA rhythm, Attention, Behavior, Bioassays and physiological analysis, Biology and life sciences, Brain electrophysiology, Brain mapping, Clinical medicine, Clinical neurophysiology, Cognition, Cognitive neuroscience, Cognitive psychology, Cognitive science, Decision making, Electroencephalography, Electrophysiological techniques, Electrophysiology, Event-related potentials, Grammar, Imaging techniques, Linguistics, Medicine and health sciences, Neuroimaging, Neurophysiology, Neuroscience, Phonology, Physiology, Psychology, Reaction time, Research and analysis methods, Research Article, Semantics, Social sciences, Syllables","advantage of the go/no-go task over the yes/no lexical decision task: erp indexes of parameters in the diffusion model.","Previous research findings supporting the advantages of the go/no-go choice over the yes/no choice in lexical decision task (LDT) have suggested that the go/no-go choice might require less cognitive resources in the non-decisional processes. This study aims to test such an idea using the event-related potential method. In this study, the tasks (yes/no LDT and go/no-go LDT) and word frequency (high and low) were manipulated, and the difference between the go/no-go choice and yes/no choice were examined with BP, pN, pN1, P200, N400, and P3 components that were assumed to be closely related with the various parameters in the diffusion model. The results showed that BP, pN and pN1 amplitudes reflecting the preparation stage were not differently affected by word frequency and the task type. However, ERPs after stimulus onset showed differences. The P200 amplitudes were smaller in the go/no-go task than in the yes/no task only for low-frequency words. N400 and P3 amplitudes were only affect)","No","word frequenc diffus task cognit neurosci reaction time alpha rhythm attent behavior bioassay physiolog analysi biolog life scienc brain electrophysiolog brain map clinic medicin clinic neurophysiolog cognit cognit neurosci cognit psycholog cognit scienc decis make electroencephalographi electrophysiolog techniqu electrophysiolog eventrel potenti grammar imag techniqu linguist medicin health scienc neuroimag neurophysiolog neurosci phonolog physiolog psycholog reaction time research analysi method research articl semant social scienc syllabl advantag task lexic decis task erp index paramet diffus model previous research find support advantag choic choic lexic decis task ldt suggest choic requir cognit resourc decision process studi aim test idea eventrel potenti method studi task ldt ldt word frequenc high low manipul differ choic choic examin bp pn pn p n p compon assum close relat paramet diffus model result show bp pn pn amplitud reflect prepar stage differ affect word frequenc task type erp stimulus onset show differ p amplitud smaller task task lowfrequ word n p amplitud affect",1
"57","NEGOTIATION, SYMPATHY, DISCOUNT, EMOTIONAL experience, EMOTIONS (Psychology), EMPATHY","and sympathy is what we need my friend‚Äîpolite requests improve negotiation results.","The wording negotiators use shapes the emotions of their counterparts. These emotions, in turn, influence their counterparts‚Äô economic decisions. Building on this rationale, we examined how the language used during negotiation affects discount rate and willingness to engage in future deals. In three studies, participants assumed the role of retailers. Alleged counterparts (actually a computerized program) asked for a discount under three conditions: request, want, and demand. Results show that less extreme language (request/want) resulted in better outcomes than demanding a discount. Moreover, while the language used by the customer had an effect on experienced emotions, the positive emotions (sympathy and empathy) participants felt toward the customer mediated the relationship between the linguistic cue and the negotiation outcome. Our results inform both psycholinguistic research and negotiation research by demonstrating the causal role of linguistic cues in activating concept-knowl)","No","negoti sympathi discount emot experi emot psycholog empathi sympathi friend polit request improv negoti result word negoti shape emot counterpart emot turn influenc counterpart econom decis build rational examin languag negoti affect discount rate willing engag futur deal studi particip assum role retail alleg counterpart computer program ask discount condit request demand result show extrem languag request result outcom demand discount languag custom effect experienc emot posit emot sympathi empathi particip felt custom mediat relationship linguist cue negoti outcom result inform psycholinguist research negoti research demonstr causal role linguist cue activ conceptknowl",1
"58","CULTURE diffusion, BANTU languages, IRON Age, HUNTING & gathering societies, AFRICA, WEST Africa, SOUTH Africa, Research Article","assessing the importance of cultural diffusion in the bantu spread into southeastern africa.","The subsistence of Neolithic populations is based on agriculture, whereas that of previous populations was based on hunting and gathering. Neolithic spreads due to dispersal of populations are called demic, and those due to the incorporation of hunter-gatherers are called cultural. It is well-known that, after agriculture appeared in West Africa, it spread across most of subequatorial Africa. It has been proposed that this spread took place alongside with that of Bantu languages. In eastern and southeastern Africa, it is also linked to the Early Iron Age. From the beginning of the last millennium BC, cereal agriculture spread rapidly from the Great Lakes area eastwards to the East African coast, and southwards to northeastern South Africa. Here we show that the southwards spread took place substantially more rapidly (1.50‚Äì2.27 km/y) than the eastwards spread (0.59‚Äì1.27 km/y). Such a faster southwards spread could be the result of a stronger cultural effect. To assess this possibility,)","No","cultur diffus bantu languag iron age hunt gather societi africa west africa south africa research articl assess import cultur diffus bantu spread southeastern africa subsist neolith popul base agricultur previous popul base hunt gather neolith spread due dispers popul call demic due incorpor huntergather call cultur agricultur appear west africa spread subequatori africa propos spread place alongsid bantu languag eastern southeastern africa link earli iron age begin millennium bc cereal agricultur spread rapid great lake area eastward east african coast southward northeastern south africa show southward spread place substanti rapid km eastward spread km faster southward spread result stronger cultur effect assess possibl",1
"59","BLAME, Behavior, Biology and life sciences, Cognitive psychology, Cognitive science, Computer and information sciences, Emotions, Grammar, Impulsivity, Information processing, Information technology, Linguistics, Mathematical and statistical techniques, Mathematics, Metaanalysis, Motivation, Neuroscience, Personality, Personality traits, Physical sciences, Prosocial behavior, Psychology, Research and analysis methods, Research Article, Social cognition, Social psychology, Social sciences, Statistical methods, Statistics","asymmetric morality: blame is more differentiated and more extreme than praise.","Despite extensive recent investigations of moral judgments, little is known about how negative judgments like blame might differ from positive judgments like praise. Drawing on theory from both social and moral cognition, the present studies identify and test potential asymmetries in the extremity and differentiatedness of blame as compared to praise. The amplified blame hypothesis predicts that people will assign greater blame for negative behaviors than praise for positive behaviors. The differentiated blame hypothesis predicts that, as compared to praise judgments, blame judgments will more finely differentiate among distinct mental states that precede action, such as thoughts, desires, and intentions. A series of studies‚Äîusing varied stimulus sets and samples‚Äîtogether provide robust support for the differentiated blame hypothesis and somewhat weaker support for the amplified blame hypotheses. These results illustrate systematic asymmetries between blame and praise, generally revea)","No","blame behavior biolog life scienc cognit psycholog cognit scienc comput inform scienc emot grammar impuls inform process inform technolog linguist mathemat statist techniqu mathemat metaanalysi motiv neurosci person person trait physic scienc prosoci behavior psycholog research analysi method research articl social cognit social psycholog social scienc statist method statist asymmetr moral blame differenti extrem prais extens recent investig moral judgment negat judgment blame differ posit judgment prais draw theori social moral cognit present studi identifi test potenti asymmetri extrem differentiated blame compar prais amplifi blame hypothesi predict peopl assign greater blame negat behavior prais posit behavior differenti blame hypothesi predict compar prais judgment blame judgment fine differenti distinct mental state preced action thought desir intent seri studi vari stimulus set sampl provid robust support differenti blame hypothesi weaker support amplifi blame hypothes result illustr systemat asymmetri blame prais general revea",1
