"","KEYWORDS","TITLE","ABSTRACT","code","text","class"
"1","KeywordsNonlinear mixed-effects location scale model Verbal learning Intra-individual variability Bayesian inference ","a bayesian nonlinear mixed-effects location scale model for learning","We present a Bayesian nonlinear mixed-effects location scale model (NL-MELSM). The NL-MELSM allows for fitting nonlinear functions to the location, or individual means, and the scale, or within-person variance. Specifically, in the context of learning, this model allows the within-person variance to follow a nonlinear trajectory, where it can be determined whether variability reduces during learning. It incorporates a sub-model that can predict nonlinear parameters for both the location and scale. This specification estimates random effects for all nonlinear location and scale parameters that are drawn from a common multivariate distribution. This allows estimation of covariances among the random effects, within and across the location and the scale. These covariances offer new insights into the interplay between individual mean structures and intra-individual variability in nonlinear parameters. We take a fully Bayesian approach, not only for ease of estimation but also for inference because it provides the necessary and consistent information for use in psychological applications, such as model selection and hypothesis testing. To illustrate the model, we use data from 333 individuals, consisting of three age groups, who participated in five learning trials that assessed verbal memory. In an exploratory context, we demonstrate that fitting a nonlinear function to the within-person variance, and allowing for individual variation therein, improves predictive accuracy compared to customary modeling techniques (e.g., assuming constant variance). We conclude by discussing the usefulness, limitations, and future directions of the NL-MELSM.","No","nonlinear mixedeffect locat scale model verbal learn intraindividu variabl bayesian infer bayesian nonlinear mixedeffect locat scale model learn present bayesian nonlinear mixedeffect locat scale model nlmelsm nlmelsm fit nonlinear function locat individu mean scale person varianc specif context learn model person varianc follow nonlinear trajectori determin variabl reduc learn incorpor model predict nonlinear paramet locat scale specif estim random effect nonlinear locat scale paramet drawn common multivari distribut estim covari random effect locat scale covari offer insight interplay individu structur intraindividu variabl nonlinear paramet fulli bayesian approach eas estim infer consist inform psycholog applic model select hypothesi test illustr model data individu consist age group particip learn trial assess verbal memori exploratori context demonstr fit nonlinear function person varianc allow individu variat improv predict accuraci compar customari model techniqu assum constant varianc conclud discuss use limit futur direct nlmelsm",1
"2","KeywordsSemantic ambiguity Homonyms Meaning frequency Homonym norming methods and data Movie subtitles Free association Homonym meaning annotations ","a comparison of homonym meaning frequency estimates derived from movie and television subtitles, free association, and explicit ratings","Most words are ambiguous, with interpretation dependent on context. Advancing theories of ambiguity resolution is important for any general theory of language processing, and for resolving inconsistencies in observed ambiguity effects across experimental tasks. Focusing on homonyms (words such as bank with unrelated meanings EDGE OF A RIVER vs. FINANCIAL INSTITUTION), the present work advances theories and methods for estimating the relative frequency of their meanings, a factor that shapes observed ambiguity effects. We develop a new method for estimating meaning frequency based on the meaning of a homonym evoked in lines of movie and television subtitles according to human raters. We also replicate and extend a measure of meaning frequency derived from the classification of free associates. We evaluate the internal consistency of these measures, compare them to published estimates based on explicit ratings of each meaning’s frequency, and compare each set of norms in predicting performance in lexical and semantic decision mega-studies. All measures have high internal consistency and show agreement, but each is also associated with unique variance, which may be explained by integrating cognitive theories of memory with the demands of different experimental methodologies. To derive frequency estimates, we collected manual classifications of 533 homonyms over 50,000 lines of subtitles, and of 357 homonyms across over 5000 homonym–associate pairs. This database—publicly available at: www.blairarmstrong.net/homonymnorms/—constitutes a novel resource for computational cognitive modeling and computational linguistics, and we offer suggestions around good practices for its use in training and testing models on labeled data.","No","semant ambigu homonym mean frequenc homonym norm method data movi subtitl free associ homonym mean annot comparison homonym mean frequenc estim deriv movi televis subtitl free associ explicit rate word ambigu interpret depend context advanc theori ambigu resolut import general theori languag process resolv inconsist observ ambigu effect experiment task focus homonym word bank unrel mean edg river financi institut present work advanc theori method estim relat frequenc mean factor shape observ ambigu effect develop method estim mean frequenc base mean homonym evok line movi televis subtitl human rater replic extend measur mean frequenc deriv classif free associ evalu intern consist measur compar publish estim base explicit rate mean frequenc compar set norm predict perform lexic semant decis megastudi measur high intern consist show agreement uniqu varianc explain integr cognit theori memori demand experiment methodolog deriv frequenc estim collect manual classif homonym line subtitl homonym homonym associ pair databas public wwwblairarmstrongnethomonymnorm constitut resourc comput cognit model comput linguist offer suggest good practic train test model label data",1
"3","KeywordsDiagnostic classification model Rating scales Psychological assessments Polytomous item responses Nominal response diagnostic model ","a general diagnostic classification model for rating scales","This study proposes and evaluates a general diagnostic classification model (DCM) for rating scales. We applied the proposed model to a dataset to compare its performance with traditional DCMs for polytomous items. We also conducted a simulation study based on the applied study condition in order to evaluate the parameter recovery of the proposed model. The findings suggest that the proposed model shows promise for (1) accommodating much smaller sample sizes by reducing a large number of parameters for estimation; (2) obtaining item category response probabilities and individual scores very similar to those from a traditional saturated model; and (3) providing general item information that is not available in traditional DCMs for polytomous items.","No","diagnost classif model rate scale psycholog assess polytom item respons nomin respons diagnost model general diagnost classif model rate scale studi propos evalu general diagnost classif model dcm rate scale appli propos model dataset compar perform tradit dcms polytom item conduct simul studi base appli studi condit order evalu paramet recoveri propos model find suggest propos model show promis accommod smaller sampl size reduc larg number paramet estim obtain item categori respons probabl individu score similar tradit satur model provid general item inform tradit dcms polytom item",1
"4","KeywordsDecision-making Evidence accumulation models Random number generation Probability density approximation ","a method, framework, and tutorial for efficiently simulating models of decision-making","Evidence accumulation models (EAMs) have become the dominant models of rapid decision-making. Several variants of these models have been proposed, ranging from the simple linear ballistic accumulator (LBA) to the more complex leaky-competing accumulator (LCA), and further extensions that include time-varying rates of evidence accumulation or decision thresholds. Although applications of the simpler variants have been widespread, applications of the more complex models have been fewer, largely due to their intractable likelihood function and the computational cost of mass simulation. Here, I present a framework for efficiently fitting complex EAMs, which uses a new, efficient method of simulating these models. I find that the majority of simulation time is taken up by random number generation (RNG) from the normal distribution, needed for the stochastic noise of the differential equation. To reduce this inefficiency, I propose using the well-known concept within computer science of “look-up tables” (LUTs) as an approximation to the inverse cumulative density function (iCDF) method of RNG, which I call “LUT-iCDF”. I show that when using an appropriately sized LUT, simulations using LUT-iCDF closely match those from the standard RNG method in R. My framework, which I provide a detailed tutorial on how to implement, includes C code for 12 different variants of EAMs using the LUT-iCDF method, and should make the implementation of complex EAMs easier and faster.","No","decisionmak evid accumul model random number generat probabl densiti approxim method framework tutori effici simul model decisionmak evid accumul model eam domin model rapid decisionmak variant model propos rang simpl linear ballist accumul lba complex leakycompet accumul lca extens includ timevari rate evid accumul decis threshold applic simpler variant widespread applic complex model fewer larg due intract likelihood function comput cost mass simul present framework effici fit complex eam effici method simul model find major simul time random number generat rng normal distribut need stochast nois differenti equat reduc ineffici propos concept comput scienc tabl lut approxim invers cumul densiti function icdf method rng call luticdf show appropri size lut simul luticdf close match standard rng method framework provid detail tutori implement includ code variant eam luticdf method make implement complex eam easier faster",1
"5","KeywordsNavigation Route learning Navigation test Cognitive aging ","a novel virtual-reality-based route-learning test suite: assessing the effects of cognitive aging on navigation","Most research groups studying human navigational behavior with virtual environment (VE) technology develop their own tasks and protocols. This makes it difficult to compare results between groups and to create normative data sets for any specific navigational task. Such norms, however, are prerequisites for the use of navigation assessments as diagnostic tools—for example, to support the early and differential diagnosis of atypical aging. Here we start addressing these problems by presenting and evaluating a new navigation test suite that we make freely available to other researchers (https://osf.io/mx52y/). Specifically, we designed three navigational tasks, which are adaptations of earlier published tasks used to study the effects of typical and atypical aging on navigation: a route-repetition task that can be solved using egocentric navigation strategies, and route-retracing and directional-approach tasks that both require allocentric spatial processing. Despite introducing a number of changes to the original tasks to make them look more realistic and ecologically valid, and therefore easy to explain to people unfamiliar with a VE or who have cognitive impairments, we replicated the findings from the original studies. Specifically, we found general age-related declines in navigation performance and additional specific difficulties in tasks that required allocentric processes. These findings demonstrate that our new tasks have task demands similar to those of the original tasks, and are thus suited to be used more widely.","No","navig rout learn navig test cognit age virtualrealitybas routelearn test suit assess effect cognit age navig research group studi human navig behavior virtual environ ve technolog develop task protocol make difficult compar result group creat normat data set specif navig task norm prerequisit navig assess diagnost tool support earli differenti diagnosi atyp age start address problem present evalu navig test suit make freeli research httpsosfiomxi specif design navig task adapt earlier publish task studi effect typic atyp age navig routerepetit task solv egocentr navig strategi routeretrac directionalapproach task requir allocentr spatial process introduc number origin task make realist ecolog valid easi explain peopl unfamiliar ve cognit impair replic find origin studi specif found general agerel declin navig perform addit specif difficulti task requir allocentr process find demonstr task task demand similar origin task suit wide",1
"6","KeywordsEye tracking Nystagmus Calibration ","a robust method for calibration of eye tracking data recorded during nystagmus","Eye tracking is a useful tool when studying the oscillatory eye movements associated with nystagmus. However, this oscillatory nature of nystagmus is problematic during calibration since it introduces uncertainty about where the person is actually looking. This renders comparisons between separate recordings unreliable. Still, the influence of the calibration protocol on eye movement data from people with nystagmus has not been thoroughly investigated. In this work, we propose a calibration method using Procrustes analysis in combination with an outlier correction algorithm, which is based on a model of the calibration data and on the geometry of the experimental setup. The proposed method is compared to previously used calibration polynomials in terms of accuracy, calibration plane distortion and waveform robustness. Six recordings of calibration data, validation data and optokinetic nystagmus data from people with nystagmus and seven recordings from a control group were included in the study. Fixation errors during the recording of calibration data from the healthy participants were introduced, simulating fixation errors caused by the oscillatory movements found in nystagmus data. The outlier correction algorithm improved the accuracy for all tested calibration methods. The accuracy and calibration plane distortion performance of the Procrustes analysis calibration method were similar to the top performing mapping functions for the simulated fixation errors. The performance in terms of waveform robustness was superior for the Procrustes analysis calibration compared to the other calibration methods. The overall performance of the Procrustes calibration methods was best for the datasets containing errors during the calibration.","No","eye track nystagmus calibr robust method calibr eye track data record nystagmus eye track tool studi oscillatori eye movement nystagmus oscillatori natur nystagmus problemat calibr introduc uncertainti person render comparison separ record unreli influenc calibr protocol eye movement data peopl nystagmus investig work propos calibr method procrust analysi combin outlier correct algorithm base model calibr data geometri experiment setup propos method compar previous calibr polynomi term accuraci calibr plane distort waveform robust record calibr data valid data optokinet nystagmus data peopl nystagmus record control group includ studi fixat error record calibr data healthi particip introduc simul fixat error caus oscillatori movement found nystagmus data outlier correct algorithm improv accuraci test calibr method accuraci calibr plane distort perform procrust analysi calibr method similar top perform map function simul fixat error perform term waveform robust superior procrust analysi calibr compar calibr method perform procrust calibr method dataset error calibr",1
"7","KeywordsBig data Topic modeling Thematic analysis Twitter Climate change Joint matrix factorization Topic alignment ","analyzing social media data: a mixed-methods framework combining computational and qualitative text analysis","To qualitative researchers, social media offers a novel opportunity to harvest a massive and diverse range of content without the need for intrusive or intensive data collection procedures. However, performing a qualitative analysis across a massive social media data set is cumbersome and impractical. Instead, researchers often extract a subset of content to analyze, but a framework to facilitate this process is currently lacking. We present a four-phased framework for improving this extraction process, which blends the capacities of data science techniques to compress large data sets into smaller spaces, with the capabilities of qualitative analysis to address research questions. We demonstrate this framework by investigating the topics of Australian Twitter commentary on climate change, using quantitative (non-negative matrix inter-joint factorization; topic alignment) and qualitative (thematic analysis) techniques. Our approach is useful for researchers seeking to perform qualitative analyses of social media, or researchers wanting to supplement their quantitative work with a qualitative analysis of broader social context and meaning.","No","big data topic model themat analysi twitter climat chang joint matrix factor topic align analyz social media data mixedmethod framework combin comput qualit text analysi qualit research social media offer opportun harvest massiv divers rang content intrus intens data collect procedur perform qualit analysi massiv social media data set cumbersom impract research extract subset content analyz framework facilit process lack present phase framework improv extract process blend capac data scienc techniqu compress larg data set smaller space capabl qualit analysi address research question demonstr framework investig topic australian twitter commentari climat chang quantit negat matrix interjoint factor topic align qualit themat analysi techniqu approach research seek perform qualit analys social media research want supplement quantit work qualit analysi broader social context mean",1
"8","KeywordsAutobiographical memory Text mining Natural language processing ","autobiographical recall of personally familiar names and temporal information in e-mails: an automatic analytic approach using e-mail communications","An important question that arises from autobiographical memory research is whether the variables that influence memory in the laboratory also drive memory for autobiographical episodes in real life. We explored this question within the context of e-mail communications and investigated the variables that influence recall for personally familiar names and temporal information in e-mails. We designed a Web-based program that analyzed each participant’s year-old sent e-mail archive and applied textual analysis algorithms to identify a set of sentences likely to be memorable. These sentences were then used as the stimuli in a cued recall task. Participants saw two sentences from their sent e-mail as a cue and attempted to recall the name of the e-mail recipient. Participants also rated the vividness of recall for the e-mail conversation and estimated the month in which they had written the e-mail. Linear mixed-effect analyses revealed that recipient name recall accuracy decreased with longer retention intervals and increased with greater frequency of contact with the recipient. Also, with longer retention intervals, participants dated e-mails as being more recent than their actual month. This telescoping error was moderately larger for e-mails with greater sentiment. These findings suggest that memory for personally familiar names and temporal information in e-mails closely follows the patterns for autobiographical memory and proper-name recall found in laboratory settings. This study introduces an innovative, Web-based experimental method for studying the cognitive processes related to autobiographical memories using ecologically valid, naturalistic communications.","No","autobiograph memori text mine natur languag process autobiograph recal person familiar name tempor inform mail automat analyt approach mail communic import question aris autobiograph memori research variabl influenc memori laboratori drive memori autobiograph episod real life explor question context mail communic investig variabl influenc recal person familiar name tempor inform mail design webbas program analyz particip year mail archiv appli textual analysi algorithm identifi set sentenc memor sentenc stimuli cu recal task particip sentenc mail cue attempt recal mail recipi particip rate vivid recal mail convers estim month written mail linear mixedeffect analys reveal recipi recal accuraci decreas longer retent interv increas greater frequenc contact recipi longer retent interv particip date mail recent actual month telescop error moder larger mail greater sentiment find suggest memori person familiar name tempor inform mail close pattern autobiograph memori proper recal found laboratori set studi introduc innov webbas experiment method studi cognit process relat autobiograph memori ecolog valid naturalist communic",1
"9","KeywordsConceptual recurrence analysis Text analysis Semantic similarity Semantic coordination Team communication Interpersonal communication ","beyond frequency counts: novel conceptual recurrence analysis metrics to index semantic coordination in team communications","Semantic alignment is a key process underlying interpersonal and team communication. However, semantic similarity is difficult to quantify, and statistical approaches designed to measure it often rely on methods that make the identification of the relative importance of key words difficult. This study outlines how conceptual recurrence analysis (CRA) can address these issues and can be used to detect conceptual structure in interpersonal communication. We developed several novel CRA metrics to analyze communication data reported previously by Mancuso, Finomore, Rahill, Blair, and Funke (Proceedings of the Human Factors and Ergonomics Society Annual Meeting, 58, 405–409, 2014), gathered from teams who worked cooperatively on a logic puzzle under different cognitive biasing contexts. CRA, like other measures of semantic coordination, relies on parameters whose values affect estimates of semantic alignment. We evaluated how the dimensionality of semantic spaces affects metrics quantifying the conceptual similarity of communicative exchanges, and whether metrics calculated from top-down, a priori semantic spaces or bottom-up semantic spaces empirically derived from each data set were more sensitive to biasing context. We found that the novel CRA measures were sensitive to manipulations of cognitive bias, and that higher-dimensional, bottom-up semantic spaces generally yielded more sensitivity to the experimental manipulations, though when the communication was evaluated with respect to specific key concepts, lower-dimensional, top-down spaces performed nearly as well. We conclude that CRA is sensitive to experimental manipulations in ways consistent with prior findings and that it presents a customizable framework for testing predictions about interpersonal communication patterns and other linguistic exchanges.","No","conceptu recurr analysi text analysi semant similar semant coordin team communic interperson communic frequenc count conceptu recurr analysi metric index semant coordin team communic semant align key process under interperson team communic semant similar difficult quantifi statist approach design measur reli method make identif relat import key word difficult studi outlin conceptu recurr analysi cra address issu detect conceptu structur interperson communic develop cra metric analyz communic data report previous mancuso finomor rahil blair funk proceed human factor ergonom societi annual meet gather team work cooper logic puzzl cognit bias context cra measur semant coordin reli paramet valu affect estim semant align evalu dimension semant space affect metric quantifi conceptu similar communic exchang metric calcul top priori semant space bottom semant space empir deriv data set sensit bias context found cra measur sensit manipul cognit bias higherdimension bottom semant space general yield sensit experiment manipul communic evalu respect specif key concept lowerdimension top space perform conclud cra sensit experiment manipul way consist prior find present customiz framework test predict interperson communic pattern linguist exchang",1
