"","KEYWORDS","TITLE","ABSTRACT","code","text","class"
"78","SPEECH perception in children, WORD recognition, SIGNAL-to-noise ratio, LANGUAGE ability, HEARING, Age groups, Anatomy, Audio equipment, Biology and life sciences, Children, Cognitive psychology, Cognitive science, Ears, Engineering and technology, Equipment, Families, Head, Hearing, Language, Linguistics, Loudspeakers, Medicine and health sciences, Neuroscience, People and places, Population groupings, Psychology, Research Article, Sensory perception, Signal processing, Signal to noise ratio, Social sciences, Speech, Speech signal processing","the mandarin spoken word‚Äîpicture identification test in noise‚Äîadaptive (mapid-a) measures subtle speech-recognition-in-noise changes and spatial release from masking in very young children.","Background:  Spatial release of masking (SRM) is a measure of an individual‚Äôs ability to perform speech-noise segregation, which is usually quantified by the extent of improvement of the individual‚Äôs speech recognition performance when the noise is switched from a spatially co-located position (e.g., speech and noise both presented from the front) to a spatially separated position (e.g., speech presented from the front and noise presented from the right side) with reference to the target speech. SRM is a combined measure of head shadow and binaural unmasking benefits. SRM has only been investigated in young children at group level but not at individual participant level in the international literature due to the lack of reliable speech recognition test materials able to detect subtle statistically significant within-participant changes in speech-recognition-in-noise thresholds. Method:  The performance to signal-to-noise ratio (P-SNR) functions of twenty-four disyllabic words were obt)","No","speech percept children word recognit signalnois ratio languag abil hear age group anatomi audio equip biolog life scienc children cognit psycholog cognit scienc ear engin technolog equip famili head hear languag linguist loudspeak medicin health scienc neurosci peopl place popul group psycholog research articl sensori percept signal process signal nois ratio social scienc speech speech signal process mandarin spoken word pictur identif test nois adapt mapid measur subtl speechrecognitionnois spatial releas mask young children background spatial releas mask srm measur individu abil perform speechnois segreg quantifi extent improv individu speech recognit perform nois switch spatial locat posit speech nois present front spatial separ posit speech present front nois present side refer target speech srm combin measur head shadow binaur unmask benefit srm investig young children group level individu particip level intern literatur due lack reliabl speech recognit test materi detect subtl statist signific particip speechrecognitionnois threshold method perform signalnois ratio snr function twenti disyllab word obt",1
"79","ARCHIPELAGOES, GENE flow, LINGUISTIC change, SPACETIME, SOCIAL interaction, JAPAN, Biodiversity, Biogeography, Biology and life sciences, Cognitive psychology, Cognitive science, Computer and information sciences, Data management, Dialectology, Earth sciences, Ecology, Ecology and environmental sciences, Evolutionary biology, Evolutionary systematics, Genetics, Geography, Geomorphology, Islands, Landforms, Language, Linguistic geography, Linguistics, Neuroscience, Phylogenetic analysis, Phylogenetics, Population biology, Population genetics, Psychology, Research Article, Social sciences, Sociolinguistics, Taxonomy, Topography","the geographical configuration of a language area influences linguistic diversity.","Like the transfer of genetic variation through gene flow, language changes constantly as a result of its use in human interaction. Contact between speakers is most likely to happen when they are close in space, time, and social setting. Here, we investigated the role of geographical configuration in this process by studying linguistic diversity in Japan, which comprises a large connected mainland (less isolation, more potential contact) and smaller island clusters of the Ryukyuan archipelago (more isolation, less potential contact). We quantified linguistic diversity using dialectometric methods, and performed regression analyses to assess the extent to which distance in space and time predict contemporary linguistic diversity. We found that language diversity in general increases as geographic distance increases and as time passes‚Äîas with biodiversity. Moreover, we found that (I) for mainland languages, linguistic diversity is most strongly related to geographic distance‚Äîa so-called )","No","archipelago gene flow linguist chang spacetim social interact japan biodivers biogeographi biolog life scienc cognit psycholog cognit scienc comput inform scienc data manag dialectolog earth scienc ecolog ecolog environment scienc evolutionari biolog evolutionari systemat genet geographi geomorpholog island landform languag linguist geographi linguist neurosci phylogenet analysi phylogenet popul biolog popul genet psycholog research articl social scienc sociolinguist taxonomi topographi geograph configur languag area influenc linguist divers transfer genet variat gene flow languag constant result human interact contact speaker happen close space time social set investig role geograph configur process studi linguist divers japan compris larg connect mainland isol potenti contact smaller island cluster ryukyuan archipelago isol potenti contact quantifi linguist divers dialectometr method perform regress analys assess extent distanc space time predict contemporari linguist divers found languag divers general increas geograph distanc increas time pass biodivers found mainland languag linguist divers strong relat geograph distanc call",1
"80","NATIVE language, JUDGMENT (Psychology), LINGUISTIC analysis, TERMS & phrases, CHINESE, JUDGMENT sampling, SEMANTICS, Amniotes, Animals, Bioinformatics, Biology and life sciences, Database and informatics methods, Equines, Eukaryota, Grammar, Horses, Languages, Lexical semantics, Linguistic morphology, Linguistics, Mammals, Organisms, Research and analysis methods, Research Article, Semantics, Sequence analysis, Social sciences, Syntax, Vertebrates","the acceptability judgment of chinese pseudo-modifiers with and without a sentential context.","This paper investigates a particular type of non-canonical construction in Mandarin Chinese displaying an apparent semantics-syntax mismatch. We conducted an acceptability judgment experiment on native Mandarin speakers to evaluate whether such sequences could stand out of context as acceptable fragments. Analyses on experimental results revealed that: both semantic and syntactic acceptability of these sequences were significantly lower than those of canonical nominal classifier phrases; whereas if contextualized, the syntactic acceptability of those sequences became similar to that of canonical nominal phrases. This suggests that the non-canonical sequences are grammatically not on the same footing as canonical expressions; and it is the sentential context that makes these sequences appear structurally well-formed. These findings contribute to general discussions on relationship between constituency and grammaticality by demonstrating the gradient nature of grammaticality, and advoca)","No","tive languag judgment psycholog linguist analysi term phrase chines judgment sampl semant amniot anim bioinformat biolog life scienc databas informat method equin eukaryota grammar hors languag lexic semant linguist morpholog linguist mammal organ research analysi method research articl semant sequenc analysi social scienc syntax vertebr accept judgment chines pseudomodifi sententi context paper investig type canon construct mandarin chines display appar semanticssyntax mismatch conduct accept judgment experi nativ mandarin speaker evalu sequenc stand context accept fragment analys experiment result reveal semant syntact accept sequenc signific lower canon nomin classifi phrase contextu syntact accept sequenc similar canon nomin phrase suggest canon sequenc grammat foot canon express sententi context make sequenc structur form find contribut general discuss relationship constitu grammat demonstr gradient natur grammat advoca",1
"81","TYPOLOGY (Psychology), TEMPERAMENT, REGRESSION trees, Algorithms, Applied mathematics, Artificial intelligence, Behavior, Biology and life sciences, Communications, Computer and information sciences, Machine learning, Mathematics, Network analysis, Neuroscience, Personality, Physical sciences, Psychology, Psychometrics, Research and analysis methods, Research Article, Sensory perception, Simulation and modeling, Social communication, Social media, Social networks, Social sciences, Sociology, Twitter","tecla: a temperament and psychological type prediction framework from twitter data.","Temperament and Psychological Types can be defined as innate psychological characteristics associated with how we relate with the world, and often influence our study and career choices. Furthermore, understanding these features help us manage conflicts, develop leadership, improve teaching and many other skills. Assigning temperament and psychological types is usually made by filling specific questionnaires. However, it is possible to identify temperamental characteristics from a linguistic and behavioral analysis of social media data from a user. Thus, machine-learning algorithms can be used to learn from a user‚Äôs social media data and infer his/her behavioral type. This paper initially provides a brief historical review of theories on temperament and then brings a survey of research aimed at predicting temperament and psychological types from social media data. It follows with the proposal of a framework to predict temperament and psychological types from a linguistic and behaviora)","No","typolog psycholog tempera regress tree algorithm appli mathemat artifici intellig behavior biolog life scienc communic comput inform scienc machin learn mathemat network analysi neurosci person physic scienc psycholog psychometr research analysi method research articl sensori percept simul model social communic social media social network social scienc sociolog twitter tecla tempera psycholog type predict framework twitter data tempera psycholog type defin innat psycholog characterist relat world influenc studi career choic understand featur manag conflict develop leadership improv teach skill assign tempera psycholog type made fill specif questionnair identifi temperament characterist linguist behavior analysi social media data user machinelearn algorithm learn user social media data infer behavior type paper initi histor review theori tempera bring survey research aim predict tempera psycholog type social media data propos framework predict tempera psycholog type linguist behaviora",1
"82","ACQUISITION of data, AUTOMATIC speech recognition, PERSONALLY identifiable information, WEB portals, MEDICAL sciences, COGNITIVE science, Age groups, Alzheimer's disease, Biology and life sciences, Cognitive impairment, Cognitive neurology, Cognitive neuroscience, Cognitive psychology, Cognitive science, Dementia, Elderly, Grammar, Language, Linguistics, Medicine and health sciences, Mental health and psychiatry, Neurodegenerative diseases, Neurology, Neuroscience, People and places, Population groupings, Psychology, Research Article, Semantics, Social sciences, Speech, Syntax","talk2me: automated linguistic data collection for personal assessment.","Language is one the earliest capacities affected by cognitive change. To monitor that change longitudinally, we have developed a web portal for remote linguistic data acquisition, called Talk2Me, consisting of a variety of tasks. In order to facilitate research in different aspects of language, we provide baselines including the relations between different scoring functions within and across tasks. These data can be used to augment studies that require a normative model; for example, we provide baseline classification results in identifying dementia. These data are released publicly along with a comprehensive open-source package for extracting approximately two thousand lexico-syntactic, acoustic, and semantic features. This package can be applied arbitrarily to studies that include linguistic data. To our knowledge, this is the most comprehensive publicly available software for extracting linguistic features. The software includes scoring functions for different tasks. [ABSTRACT FROM)","No","acquisit data automat speech recognit person identifi inform web portal medic scienc cognit scienc age group alzheim diseas biolog life scienc cognit impair cognit neurolog cognit neurosci cognit psycholog cognit scienc dementia elder grammar languag linguist medicin health scienc mental health psychiatri neurodegen diseas neurolog neurosci peopl place popul group psycholog research articl semant social scienc speech syntax talkm autom linguist data collect person assess languag earliest capac affect cognit chang monitor chang longitudin develop web portal remot linguist data acquisit call talkm consist varieti task order facilit research aspect languag provid baselin includ relat score function task data augment studi requir normat model provid baselin classif result identifi dementia data releas public comprehens opensourc packag extract approxim thousand lexicosyntact acoust semant featur packag appli arbitrarili studi includ linguist data knowledg comprehens public softwar extract linguist featur softwar includ score function task abstract",1
"83","PHASE transformations (Physics), SEMANTICS, WORD recognition, COGNITION, LINGUISTICS, Biology and life sciences, Cognition, Cognitive linguistics, Cognitive psychology, Cognitive science, Computer and information sciences, Dynamical systems, Grammar, Language, Languages, Linguistics, Mathematics, Natural language, Neuroscience, Physical sciences, Psycholinguistics, Psychology, Research Article, Semantics, Social sciences, Syntax, Systems science","switching between reading tasks leads to phase-transitions in reading times in l1 and l2 readers.","Reading research uses different tasks to investigate different levels of the reading process, such as word recognition, syntactic parsing, or semantic integration. It seems to be tacitly assumed that the underlying cognitive process that constitute reading are stable across those tasks. However, nothing is known about what happens when readers switch from one reading task to another. The stability assumptions of the reading process suggest that the cognitive system resolves this switching between two tasks quickly. Here, we present an alternative language-game hypothesis (LGH) of reading that begins by treating reading as a softly-assembled process and that assumes, instead of stability, context-sensitive flexibility of the reading process. LGH predicts that switching between two reading tasks leads to longer lasting phase-transition like patterns in the reading process. Using the nonlinear-dynamical tool of recurrence quantification analysis, we test these predictions by examining se)","No","phase transform physic semant word recognit cognit linguist biolog life scienc cognit cognit linguist cognit psycholog cognit scienc comput inform scienc dynam system grammar languag languag linguist mathemat natur languag neurosci physic scienc psycholinguist psycholog research articl semant social scienc syntax system scienc switch read task lead phasetransit read time l l reader read research task investig level read process word recognit syntact pars semant integr tacit assum under cognit process constitut read stabl task reader switch read task stabil assumpt read process suggest cognit system resolv switch task quick present altern languagegam hypothesi lgh read begin treat read softlyassembl process assum stabil contextsensit flexibl read process lgh predict switch read task lead longer last phasetransit pattern read process nonlineardynam tool recurr quantif analysi test predict examin se",1
"84","MAGNETIC resonance imaging, ENDOMETRIAL cancer, MEDICAL personnel, RADIOLOGISTS, GYNECOLOGISTS, Biology and life sciences, Cancer detection and diagnosis, Cancer treatment, Cancers and neoplasms, Cognition, Cognitive psychology, Cognitive science, Decision making, Diagnostic medicine, Diagnostic radiology, Gynecologic surgery, Gynecological tumors, Imaging techniques, Magnetic resonance imaging, Medical personnel, Medicine and health sciences, Neuroscience, Oncology, People and places, Population groupings, Professions, Psychology, Radiologists, Radiology and imaging, Research and analysis methods, Research Article, Social sciences, Surgical and invasive medical procedures, Uterine cancer","structured reports of pelvic magnetic resonance imaging in primary endometrial cancer: potential benefits for clinical decision-making.","Background:  Although evidence is increasing that the implementation of structured reports (SRs) may increase the standardization of reports and improve communication between radiologists and end-users, it is unclear whether these alternative formats of Chinese radiological narratives are appealing or even acceptable to radiologists and clinicians. Objective:  To compare the effect of SRs and non-structured reports (NSRs) of pelvic magnetic resonance imaging (MRI) in patients with primary endometrial cancer on referring gynecologists‚Äô satisfaction, further decision-making and efficiency. Methods:  Forty-one patients with histologically proven endometrial cancer were included in this study. SRs and NSRs for local MRI staging of endometrial cancer were generated for all subjects. NSRs were generated during clinical routine practice. The same 41 uterine studies were reviewed by the same radiologist using structured reporting system after a period of time. Two radiologists compared SRs on)","No","magnet reson imag endometri cancer medic personnel radiologist gynecologist biolog life scienc cancer detect diagnosi cancer treatment cancer neoplasm cognit cognit psycholog cognit scienc decis make diagnost medicin diagnost radiolog gynecolog surgeri gynecolog tumor imag techniqu magnet reson imag medic personnel medicin health scienc neurosci oncolog peopl place popul group profess psycholog radiologist radiolog imag research analysi method research articl social scienc surgic invas medic procedur uterin cancer structur report pelvic magnet reson imag primari endometri cancer potenti benefit clinic decisionmak background evid increas implement structur report srs increas standard report improv communic radiologist endus unclear altern format chines radiolog narrat appeal accept radiologist clinician object compar effect srs structur report nsrs pelvic magnet reson imag mri patient primari endometri cancer refer gynecologist satisfact decisionmak effici method forti patient histolog proven endometri cancer includ studi srs nsrs local mri stage endometri cancer generat subject nsrs generat clinic routin practic uterin studi review radiologist structur report system period time radiologist compar srs",1
"85","TEST scoring, LANGUAGE disorders, LANGUAGE ability testing, POPULATION, COGNITIVE psychology, GREAT Britain, Age groups, Behavior, Biology and life sciences, Children, Cognitive psychology, Cognitive science, Education, Families, Grammar, Language, Linguistics, Mathematics, Neuroscience, People and places, Phonology, Physical sciences, Population groupings, Probability distribution, Probability theory, Psychology, Research Article, Schools, Semantics, Skewness, Social sciences, Sociology, Vocabulary","standardizing test scores for a target population: the lms method illustrated using language measures from the scales project.","Background:  Centile curves and standard scores are common in epidemiological research. However, standardised norms and centile growth curves for language disorder that reflect the entire UK local school population do not exist. Methods:  Scores on six language indices assessing receptive and expressive functioning of children were obtained from the SCALES population survey. Monolingual English speaking participants were aged between five and nine years. Children who attended special schools at study intake, or who were learning English as an additional language were excluded. We constructed language norms using the LMS method of standardisation which allows for skewed measurements. We made use of probability weights that were produced from a two-step logistic model. Distributions of estimated standard scores from an intensively assessed sub-population and from the full population were contrasted to demonstrate the role of weights. Results:  Non-overlapping centile curves and standard)","No","test score languag disord languag abil test popul cognit psycholog great britain age group behavior biolog life scienc children cognit psycholog cognit scienc educ famili grammar languag linguist mathemat neurosci peopl place phonolog physic scienc popul group probabl distribut probabl theori psycholog research articl school semant skew social scienc sociolog vocabulari standard test score target popul lms method illustr languag measur scale project background centil curv standard score common epidemiolog research standardis norm centil growth curv languag disord reflect entir uk local school popul exist method score languag indic assess recept express function children obtain scale popul survey monolingu english speak particip age year children attend special school studi intak learn english addit languag exclud construct languag norm lms method standardis skew measur made probabl weight produc step logist model distribut estim standard score intens assess popul full popul contrast demonstr role weight result overlap centil curv standard",1
"86","TAGS (Metadata), SEMANTICS, MICROBLOGS, DATA analysis, hashtag recommendation, LDA, semantic LDA, short text, Topic modeling, Twitter, TWITTER (Web resource)","semantic knowledge lda with topic vector for recommending hashtags: twitter use case.","Topic Modeling encompasses a set of techniques for text clustering and tag recommendation with significant advantages such as unsupervised learning. Based on Latent Dirichlet Allocation (LDA) topic modeling, every single word is related to a set of topics with different weight. The weights are further estimated in order to determine the semantic relation between the words and the rest of the documents. Apparently the chief drawback of topic modeling techniques, specifically LDA, lies on their incapability in clustering short texts in which semantic relation between words is neglected. This issue is deemed more severe when analyzing social networks such as Twitter wherein short texts are the case. It is assumed that semantic relation between a document and the target short text helps obtain efficient clustering of short texts via topic modeling. Hence, the current paper proposes a method of topic modeling named Semantic Knowledge LDA based on semantic relations between the words in twe)","No","tag metadata semant microblog data analysi hashtag recommend lda semant lda short text topic model twitter twitter web resourc semant knowledg lda topic vector recommend hashtag twitter case topic model encompass set techniqu text cluster tag recommend signific advantag unsupervis learn base latent dirichlet alloc lda topic model singl word relat set topic weight weight estim order determin semant relat word rest document appar chief drawback topic model techniqu specif lda lie incap cluster short text semant relat word neglect issu deem sever analyz social network twitter short text case assum semant relat document target short text help obtain effici cluster short text topic model current paper propos method topic model name semant knowledg lda base semant relat word twe",1
