"","KEYWORDS","TITLE","ABSTRACT","code","text","class"
"21","KeywordsProtected values Consequentialism Same-sex marriage Latent Dirichlet allocation Reddit ","think of the consequences: a decade of discourse about same-sex marriage","Approaching issues through the lens of nonnegotiable values increases the perceived intractability of debate (Baron & Spranca in Organizational Behavior and Human Decision Processes, 70, 1–16, 1997), while focusing on the concrete consequences of policies instead results in the moderation of extreme opinions (Fernbach, Rogers, Fox, & Sloman in Psychological Science, 24, 939–946, 2013) and a greater likelihood of conflict resolution (Baron & Leshner in Journal of Experimental Psychology: Applied, 6, 183–194, 2000). Using comments on the popular social media platform Reddit from January 2006 until September 2017, we showed how changes in the framing of same-sex marriage in public discourse relate to changes in public opinion. We used a topic model to show that the contributions of certain protected-values-based topics to the debate (religious arguments and freedom of opinion) increased prior to the emergence of a public consensus in support of same-sex marriage (Gallup, 2017), and declined afterward. In contrast, the discussion of certain consequentialist topics (the impact of politicians’ stance and same-sex marriage as a matter of policy) showed the opposite pattern. Our results reinforce the meaningfulness of protected values and consequentialism as relevant dimensions for describing public discourse and highlight the usefulness of unsupervised machine-learning methods in tackling questions about social attitude change.","No","protect valu consequenti sex marriag latent dirichlet alloc reddit consequ decad discours sex marriag approach issu len nonnegoti valu increas perceiv intract debat baron spranca organiz behavior human decis process focus concret consequ polici result moder extrem opinion fernbach roger fox sloman psycholog scienc greater likelihood conflict resolut baron leshner journal experiment psycholog appli comment popular social media platform reddit januari septemb show frame sex marriag public discours relat public opinion topic model show contribut protectedvaluesbas topic debat religi argument freedom opinion increas prior emerg public consensus support sex marriag gallup declin afterward contrast discuss consequentialist topic impact politician stanc sex marriag matter polici show opposit pattern result reinforc meaning protect valu consequenti relev dimens describ public discours highlight use unsupervis machinelearn method tackl question social attitud chang",1
"22","KeywordsCohesion Coherence Natural language processing Essay quality Speaking proficiency ","the tool for the automatic analysis of cohesion 2.0: integrating semantic similarity and text overlap","This article introduces the second version of the Tool for the Automatic Analysis of Cohesion (TAACO 2.0). Like its predecessor, TAACO 2.0 is a freely available text analysis tool that works on the Windows, Mac, and Linux operating systems; is housed on a user’s hard drive; is easy to use; and allows for batch processing of text files. TAACO 2.0 includes all the original indices reported for TAACO 1.0, but it adds a number of new indices related to local and global cohesion at the semantic level, reported by latent semantic analysis, latent Dirichlet allocation, and word2vec. The tool also includes a source overlap feature, which calculates lexical and semantic overlap between a source and a response text (i.e., cohesion between the two texts based measures of text relatedness). In the first study in this article, we examined the effects that cohesion features, prompt, essay elaboration, and enhanced cohesion had on expert ratings of text coherence, finding that global semantic similarity as reported by word2vec was an important predictor of coherence ratings. A second study was conducted to examine the source and response indices. In this study we examined whether source overlap between the speaking samples found in the TOEFL-iBT integrated speaking tasks and the responses produced by test-takers was predictive of human ratings of speaking proficiency. The results indicated that the percentage of keywords found in both the source and response and the similarity between the source document and the response, as reported by word2vec, were significant predictors of speaking quality. Combined, these findings help validate the new indices reported for TAACO 2.0.","No","cohes coher natur languag process essay qualiti speak profici tool automat analysi cohes integr semant similar text overlap articl introduc version tool automat analysi cohes taaco predecessor taaco freeli text analysi tool work window mac linux oper system hous user hard drive easi batch process text file taaco includ origin indic report taaco add number indic relat local global cohes semant level report latent semant analysi latent dirichlet alloc wordvec tool includ sourc overlap featur calcul lexic semant overlap sourc respons text cohes text base measur text related studi articl examin effect cohes featur prompt essay elabor enhanc cohes expert rate text coher find global semant similar report wordvec import predictor coher rate studi conduct examin sourc respons indic studi examin sourc overlap speak sampl found toeflibt integr speak task respons produc testtak predict human rate speak profici result percentag keyword found sourc respons similar sourc document respons report wordvec signific predictor speak qualiti combin find valid indic report taaco",1
"23","KeywordsCognitive computing Document representation and retrieval Search engine BEAGLE Computational linguistics ","the semantic librarian: a search engine built from vector-space models of semantics","Psychologists have made substantial progress at developing empirically validated formal expressions of how people perceive, learn, remember, think, and know. In this article, we present an academic search engine for cognitive psychology that leverages computational expressions of human cognition (vector-space models of semantics) to represent and find articles in the psychological record. The method shows how psychological theory can be used to inform and aid the design of psychologically intuitive computer interfaces.","No","cognit comput document represent retriev search engin beagl comput linguist semant librarian search engin built vectorspac model semant psychologist made substanti progress develop empir valid formal express peopl perceiv learn rememb articl present academ search engin cognit psycholog leverag comput express human cognit vectorspac model semant repres find articl psycholog record method show psycholog theori inform aid design psycholog intuit comput interfac",1
"24","KeywordsSemantic judgment Best-worst scaling Rating scales ","the role of number of items per trial in best‚Äìworst scaling experiments","Best–worst scaling is a judgment format in which participants are presented with K items and must choose the best and worst items from that set, along some underlying latent dimension. Best–worst scaling has seen recent use in natural-language processing and psychology to collect lexical semantic norms. In such applications, four items have always been presented on each trial. The present study provides reasoning that values other than 4 might provide better estimates of latent values. The results from simulation experiments and behavioral research confirmed this: Both suggest that, in the general case, six items per trial better reduces errors in the latent value estimates.","No","semant judgment worst scale rate scale role number item trial worst scale experi worst scale judgment format particip present item choos worst item set under latent dimens worst scale recent naturallanguag process psycholog collect lexic semant norm applic item present trial present studi reason valu provid estim latent valu result simul experi behavior research confirm suggest general case item trial reduc error latent estim",1
"25","KeywordsPitch perception Musical abilities Pitch accuracy Gold-MSI ","the mistuning perception test: a new measurement instrument","An important aspect of the perceived quality of vocal music is the degree to which the vocalist sings in tune. Although most listeners seem sensitive to vocal mistuning, little is known about the development of this perceptual ability or how it differs between listeners. Motivated by a lack of suitable preexisting measures, we introduce in this article an adaptive and ecologically valid test of mistuning perception ability. The stimulus material consisted of short excerpts (6 to 12 s in length) from pop music performances (obtained from MedleyDB; Bittner et al., 2014) for which the vocal track was pitch-shifted relative to the instrumental tracks. In a first experiment, 333 listeners were tested on a two-alternative forced choice task that tested discrimination between a pitch-shifted and an unaltered version of the same audio clip. Explanatory item response modeling was then used to calibrate an adaptive version of the test. A subsequent validation experiment applied this adaptive test to 66 participants with a broad range of musical expertise, producing evidence of the test’s reliability, convergent validity, and divergent validity. The test is ready to be deployed as an experimental tool and should make an important contribution to our understanding of the human ability to judge mistuning.","No","pitch percept music abil pitch accuraci goldmsi mistun percept test measur instrument import aspect perceiv qualiti vocal music degre vocalist sing tune listen sensit vocal mistun develop perceptu abil differ listen motiv lack suitabl preexist measur introduc articl adapt ecolog valid test mistun percept abil stimulus materi consist short excerpt length pop music perform obtain medleydb bittner al vocal track pitchshift relat instrument track experi listen test altern forc choic task test discrimin pitchshift unalt version audio clip explanatori item respons model calibr adapt version test subsequ valid experi appli adapt test particip broad rang music expertis produc evid test reliabl converg valid diverg valid test readi deploy experiment tool make import contribut understand human abil judg mistun",1
"26","KeywordsSemantics Language evolution Language statistics Word embedding ","the macroscope: a tool for examining the historical structure of language","The recent rise in digitized historical text has made it possible to quantitatively study our psychological past. This involves understanding changes in what words meant, how words were used, and how these changes may have responded to changes in the environment, such as in healthcare, wealth disparity, and war. Here we make available a tool, the Macroscope, for studying historical changes in language over the last two centuries. The Macroscope uses over 155 billion words of historical text, which will grow as we include new historical corpora, and derives word properties from frequency-of-usage and co-occurrence patterns over time. Using co-occurrence patterns, the Macroscope can track changes in semantics, allowing researchers to identify semantically stable and unstable words in historical text and providing quantitative information about changes in a word’s valence, arousal, and concreteness, as well as information about new properties, such as semantic drift. The Macroscope provides information about both the local and global properties of words, as well as information about how these properties change over time, allowing researchers to visualize and download data in order to make inferences about historical psychology. Although quantitative historical psychology represents a largely new field of study, we see this work as complementing a wealth of other historical investigations, offering new insights and new approaches to understanding existing theory. The Macroscope is available online at http://www.macroscope.tech.","No","semant languag evolut languag statist word embed macroscop tool examin histor structur languag recent rise digit histor text made quantit studi psycholog past involv understand word meant word respond environ healthcar wealth dispar war make tool macroscop studi histor languag centuri macroscop billion word histor text grow includ histor corpora deriv word properti frequencyusag occurr pattern time occurr pattern macroscop track semant allow research identifi semant stabl unstabl word histor text provid quantit inform word valenc arous concret inform properti semant drift macroscop inform local global properti word inform properti chang time allow research visual download data order make infer histor psycholog quantit histor psycholog repres larg field studi work complement wealth histor investig offer insight approach understand exist theori macroscop onlin httpwwwmacroscopetech",1
"27","KeywordsPupillometry Executive functioning Arousal Cognitive load Psychophysics ","the human task-evoked pupillary response function is linear: implications for baseline response scaling in pupillometry","The human task-evoked pupillary response provides a sensitive physiological index of the intensity and online resource demands of numerous cognitive processes (e.g., memory retrieval, problem solving, or target detection). Cognitive pupillometry is a well-established technique that relies upon precise measurement of these subtle response functions. Baseline variability of pupil diameter is a complex artifact that typically necessitates mathematical correction. A methodological paradox within pupillometry is that linear and nonlinear forms of baseline scaling both remain accepted baseline correction techniques, despite yielding highly disparate results. The task-evoked pupillary response (TEPR) could potentially scale nonlinearly, similar to autonomic functions such as heart rate, in which the amplitude of an evoked response diminishes as the baseline rises. Alternatively, the TEPR could scale similarly to the cortical hemodynamic response, as a linear function that is independent of its baseline. However, the TEPR cannot scale both linearly and nonlinearly. Our aim was to adjudicate between linear and nonlinear scaling of human TEPR. We manipulated baseline pupil size by modulating the illuminance in the testing room as participants heard abrupt pure-tone transitions (Exp. 1) or visually monitored word lists (Exp. 2). Phasic pupillary responses scaled according to a linear function across all lighting (dark, mid, bright) and task (tones, words) conditions, demonstrating that the TEPR is independent of its baseline amplitude. We discuss methodological implications and identify a need to reevaluate past pupillometry studies.","No","pupillometri execut function arous cognit load psychophys human taskevok pupillari respons function linear implic baselin respons scale pupillometri human taskevok pupillari respons sensit physiolog index intens onlin resourc demand numer cognit process memori retriev problem solv target detect cognit pupillometri establish techniqu reli precis measur subtl respons function baselin variabl pupil diamet complex artifact typic necessit mathemat correct methodolog paradox pupillometri linear nonlinear form baselin scale remain accept baselin correct techniqu yield high dispar result taskevok pupillari respons tepr potenti scale nonlinear similar autonom function heart rate amplitud evok respons diminish baselin rise altern tepr scale similar cortic hemodynam respons linear function independ baselin tepr scale linear nonlinear aim adjud linear nonlinear scale human tepr manipul baselin pupil size modul illumin test room particip heard abrupt pureton transit exp visual monitor word list exp phasic pupillari respons scale linear function light dark mid bright task tone word condit demonstr tepr independ baselin amplitud discuss methodolog implic identifi reevalu past pupillometri studi",1
"28","KeywordsPsycholinguistic norms Arousal Valence Dominance Concreteness Imageability Familiarity Age of acquisition Semantic size Gender association ","the glasgow norms: ratings of 5,500 words on nine scales","The Glasgow Norms are a set of normative ratings for 5,553 English words on nine psycholinguistic dimensions: arousal, valence, dominance, concreteness, imageability, familiarity, age of acquisition, semantic size, and gender association. The Glasgow Norms are unique in several respects. First, the corpus itself is relatively large, while simultaneously providing norms across a substantial number of lexical dimensions. Second, for any given subset of words, the same participants provided ratings across all nine dimensions (33 participants/word, on average). Third, two novel dimensions—semantic size and gender association—are included. Finally, the corpus contains a set of 379 ambiguous words that are presented either alone (e.g., toast) or with information that selects an alternative sense (e.g., toast (bread), toast (speech)). The relationships between the dimensions of the Glasgow Norms were initially investigated by assessing their correlations. In addition, a principal component analysis revealed four main factors, accounting for 82% of the variance (Visualization, Emotion, Salience, and Exposure). The validity of the Glasgow Norms was established via comparisons of our ratings to 18 different sets of current psycholinguistic norms. The dimension of size was tested with megastudy data, confirming findings from past studies that have explicitly examined this variable. Alternative senses of ambiguous words (i.e., disambiguated forms), when discordant on a given dimension, seemingly led to appropriately distinct ratings. Informal comparisons between the ratings of ambiguous words and of their alternative senses showed different patterns that likely depended on several factors (the number of senses, their relative strengths, and the rating scales themselves). Overall, the Glasgow Norms provide a valuable resource—in particular, for researchers investigating the role of word recognition in language comprehension.","No","psycholinguist norm arous valenc domin concret imag familiar age acquisit semant size gender associ glasgow norm rate word scale glasgow norm set normat rate english word psycholinguist dimens arous valenc domin concret imag familiar age acquisit semant size gender associ glasgow norm uniqu respect corpus larg simultan provid norm substanti number lexic dimens subset word particip provid rate dimens participantsword averag dimens semant size gender associ includ final corpus set ambigu word present toast inform select altern sens toast bread toast speech relationship dimens glasgow norm initi investig assess correl addit princip compon analysi reveal main factor account varianc visual emot salienc exposur valid glasgow norm establish comparison rate set current psycholinguist norm dimens size test megastudi data confirm find past studi explicit examin variabl altern sens ambigu word disambigu form discord dimens seem led appropri distinct rate inform comparison rate ambigu word altern sens show pattern depend factor number sens relat strength rate scale glasgow norm provid valuabl resourc research investig role word recognit languag comprehens",1
"29","KeywordsMeasurement of facial movement Emotion expression Optical measurement Video data analysis Open-source software ","the blenderface method: video-based measurement of raw movement data during facial expressions of emotion using open-source software","This article proposes an optical measurement of movement applied to data from video recordings of facial expressions of emotion. The approach offers a way to capture motion adapted from the film industry in which markers placed on the skin of the face can be tracked with a pattern-matching algorithm. The method records and postprocesses raw facial movement data (coordinates per frame) of distinctly placed markers and is intended for use in facial expression research (e.g., microexpressions) in laboratory settings. Due to the explicit use of specifically placed, artificial markers, the procedure offers the simultaneous measurement of several emotionally relevant markers in a (psychometrically) objective and artifact-free way, even for facial regions without natural landmarks (e.g., the cheeks). In addition, the proposed procedure is fully based on open-source software and is transparent at every step of data processing. Two worked examples demonstrate the practicability of the proposed procedure: In Study 1(N= 39), the participants were instructed to show the emotions happiness, sadness, disgust, and anger, and in Study 2 (N= 113), they were asked to present both a neutral face and the emotions happiness, disgust, and fear. Study 2 involved the simultaneous tracking of 14 markers for approximately 12 min per participant with a time resolution of 33 ms. The measured facial movements corresponded closely to the assumptions of established measurement instruments (EMFACS, FACSAID, Friesen & Ekman, 1983; Ekman & Hager, 2002). In addition, the measurement was found to be very precise with sub-second, sub-pixel, and sub-millimeter accuracy.","No","measur facial movement emot express optic measur video data analysi opensourc softwar blenderfac method videobas measur raw movement data facial express emot opensourc softwar articl propos optic measur movement appli data video record facial express emot approach offer captur motion adapt film industri marker skin face track patternmatch algorithm method record postprocess raw facial movement data coordin frame distinct marker intend facial express research microexpress laboratori set due explicit specif artifici marker procedur offer simultan measur emot relev marker psychometr object artifactfre facial region natur landmark cheek addit propos procedur fulli base opensourc softwar transpar step data process work exampl demonstr practic propos procedur studi particip instruct show emot happi sad disgust anger studi ask present neutral face emot happi disgust fear studi involv simultan track marker approxim min particip time resolut ms measur facial movement correspond close assumpt establish measur instrument emfac facsaid friesen ekman ekman hager addit measur found precis pixel millimet accuraci",1
"30","KeywordsWord associations Mental lexicon Networks Similarity Spreading activation ","the ‚Äúsmall world of words‚Äù english word association norms for over 12,000 cue words","Word associations have been used widely in psychology, but the validity of their application strongly depends on the number of cues included in the study and the extent to which they probe all associations known by an individual. In this work, we address both issues by introducing a new English word association dataset. We describe the collection of word associations for over 12,000 cue words, currently the largest such English-language resource in the world. Our procedure allowed subjects to provide multiple responses for each cue, which permits us to measure weak associations. We evaluate the utility of the dataset in several different contexts, including lexical decision and semantic categorization. We also show that measures based on a mechanism of spreading activation derived from this new resource are highly predictive of direct judgments of similarity. Finally, a comparison with existing English word association sets further highlights systematic improvements provided through these new norms.","No","word associ mental lexicon network similar spread activ small world word english word associ norm cue word word associ wide psycholog valid applic strong depend number cue includ studi extent probe associ individu work address issu introduc english word associ dataset describ collect word associ cue word largest englishlanguag resourc world procedur allow subject provid multipl respons cue permit measur weak associ evalu util dataset context includ lexic decis semant categor show measur base mechan spread activ deriv resourc high predict direct judgment similar final comparison exist english word associ set highlight systemat improv provid norm",1
